organisation_chain_raw,organisation_name,tender_active,tender_url,tender_id,tender_category,no_of_covers,emd_amount,tender_fee,processing_fee,title,work_description,tender_value,tender_value_num,product_category,period_of_work_days,form_of_contract,location,bid_submission_end_date,bid_end_iso,tender_inviting_authority,authority_address
"Kerala State Construction Corporation Ltd||General Manager,Administrative Office,Kochi",Kerala State Construction Corporation Ltd,1,https://etenders.kerala.gov.in/nicgep/app?component=%24DirectLink_0&page=FrontEndAdvancedSearchResult&service=direct&session=T&sp=SN9CAk6vwJ7i62yUKpCAeGA%3D%3D,2026_KSCC_857126_1,Works,1,"6,930",615,295,LAC ADS Underground Water Storage unit Valavannur Project No 1512 Electrification Electrification of Underground Water Storage unit Valavannur General Electrical Work,Electrical,"2,77,183",277183.0,Electrical Works,60,Item Rate,vyttila,29-Jun-2026 05:00 PM,2026-06-29 17:00:00,Regional Manager Electrical Kozhikode,"KSCC Regional office, kkd"
Kerala Co-operative Milk Marketing Federation Ltd||Ernakulam Regional Co-operative Milk Producers Union Ltd||Ernakulam Dairy Thripunithura Ernakulam,Kerala Co-operative Milk Marketing Federation Ltd,1,https://etenders.kerala.gov.in/nicgep/app?component=%24DirectLink_0&page=FrontEndAdvancedSearchResult&service=direct&session=T&sp=SRdYsxZt8sxiWnlYG01gO5Q%3D%3D,2026_KCMMF_854529_2,Goods,2,"41,300","4,130",767,RE E TENDER FOR SUPPLY ERECTION INSTALLATION TESTING AND COMMISSIONING OF EVAPORATIVE CONDENSER AT ERNAKULAM DAIRY,RE E TENDER FOR SUPPLY ERECTION INSTALLATION TESTING AND COMMISSIONING OF EVAPORATIVE CONDENSER AT ERNAKULAM DAIRY,"41,30,000",4130000.0,Equipments,60,Turn-key,Ernakulam Dairy,29-Jun-2026 04:00 PM,2026-06-29 16:00:00,Senior Manager,Ernakulam Dairy Tripunithura
Transformers and Electricals Kerala Ltd.||TELK Angamaly South||C and M,Transformers and Electricals Kerala Ltd.,1,https://etenders.kerala.gov.in/nicgep/app?component=%24DirectLink_0&page=FrontEndAdvancedSearchResult&service=direct&session=T&sp=SbsPtvfaaRREONMsPnvlO2w%3D%3D,2026_TEKL_857129_1,Goods,2,"12,509",0.00,295,FABRICATION AND SUPPLY OF CORE CLAMP AS PER SCOPELIST OF KSEB 20 MVA TRF,FABRICATION AND SUPPLY OF CORE CLAMP AS PER SCOPELIST OF KSEB 20 MVA TRF,,,"Spares,Components, Assy, Sub assy",365,Item Wise,TELK ANGAMALY,29-Jun-2026 04:00 PM,2026-06-29 16:00:00,MANAGER,TELK ANGAMALY
PWD||Chief Engineer (Roads and Bridges)||SE Roads (N),PWD,1,https://etenders.kerala.gov.in/nicgep/app?component=%24DirectLink_0&page=FrontEndAdvancedSearchResult&service=direct&session=T&sp=SYJrKms1%2BhDtBSfgUKVnG8Q%3D%3D,2026_PWD_854095_2,Works,1,"1,00,000","8,270","1,534",GENERAL RP 2025 26 Improvement and providing BM and BC to Kalpathur VellyoorKappummal road between Km 7 500 10 400 kozhikkode General Civil Work,Road widening with GSB BM and BC road marking new drain and culvert DR masonry hard shoulder road marking etc,"3,80,08,215",38008215.0,Civil Works - Roads,240,Item Rate,Kalpathoor velliyoor,02-Jul-2026 02:00 PM,2026-07-02 14:00:00,"Superintending Engineer,PWD Roads north circle","Office of the Superintending Engineer,PWD Roads north circle,kozhikode"
PWD||Chief Engineer (Buildings)||SE Bldgs (S)||EE Bldgs (ALP),PWD,1,https://etenders.kerala.gov.in/nicgep/app?component=%24DirectLink_0&page=FrontEndAdvancedSearchResult&service=direct&session=T&sp=SUC94ta5mFwgDZWcEt6HQwg%3D%3D,2026_PWD_857014_1,Works,1,"39,723","2,760",767,GENERAL Budget Work 2024 2025 Construction of various Anganwadis in Aroor LAC Ward No I V Anganwadi No 84 in Perumbalam Grama Panchayath General Civil Work,GENERAL Budget Work 2024 2025 Construction of various Anganwadis in Aroor LAC Ward No I V Anganwadi No 84 in Perumbalam Grama Panchayath General Civil Work,"15,88,911",1588911.0,Civil Works - Buildings,180,Item Rate,Alappuzha,29-Jun-2026 04:00 PM,2026-06-29 16:00:00,Executive Engineer,ExecutiveEngineerPWD BuildingDivisionAlappuzha
"Kerala Water Authority||Chief Engineer Central Region (Kochi)||Superintending Engineer PH Circle Thrissur||Executive Engineer (PH Division Thrissur)||AEE , PH Sub Division, Guruvayur",Kerala Water Authority,1,https://etenders.kerala.gov.in/nicgep/app?component=%24DirectLink_0&page=FrontEndAdvancedSearchResult&service=direct&session=T&sp=SP5CQPFTGF0Kmgr%2FQ6K517g%3D%3D,2026_KWA_856783_1,Works,1,"9,528",840,295,State Plan-2025-26-Guruvayur Drainage Scheme- Supply fixing and commissioning of 15HP Centrifugal drainage recirculating pump set-at Sewerage Treatment Plant Chakkamkandam Guruvayur-General Civil Work,State Plan-2025-26-Guruvayur Drainage Scheme- Supply fixing and commissioning of 15HP Centrifugal drainage recirculating pump set-at Sewerage Treatment Plant Chakkamkandam Guruvayur-General Civil Work,"3,81,106",381106.0,Civil Works - Water Works,180,Item Rate,"CHAKKUMKANDAM, GURUVAYUR",27-Jun-2026 03:30 PM,2026-06-27 15:30:00,Assistant Executive Engineer,"Assistant Executive Engineer PH Subdivision, Guruvayur"
"Kerala State Construction Corporation Ltd||General Manager,Administrative Office,Kochi",Kerala State Construction Corporation Ltd,1,https://etenders.kerala.gov.in/nicgep/app?component=%24DirectLink_0&page=FrontEndAdvancedSearchResult&service=direct&session=T&sp=SKoK3XTyT8hnd7o5GoZZbFw%3D%3D,2026_KSCC_857113_1,Works,1,"6,352",560,295,LAC ADS Electrification of Alankode Valayamkulam Bus Waiting Shed towards Thrissur Kozhikode Project No LAC21121 General Electrical Work,Electrical work,"2,54,069",254069.0,Electrical Works,120,Item Rate,vyttila,29-Jun-2026 05:00 PM,2026-06-29 17:00:00,Regional Manager Electrical Kozhikode,"KSCC Regional office, kkd"
Kerala State Beverages Corporation Ltd,Kerala State Beverages Corporation Ltd,1,https://etenders.kerala.gov.in/nicgep/app?component=%24DirectLink_0&page=FrontEndAdvancedSearchResult&service=direct&session=T&sp=SqYqvr6WeC27BtjEVnyOULQ%3D%3D,2026_KSBC_854303_2,Services,2,"1,00,000","2,950",295,E tenders are invited for the sale of empty carton for the period of six months from the existing 8 FL-1 shops and newly opening FL-1 shops currently operating under the jurisdiction of Palakkad warehouse in the North-1 region of KSBC,E tenders are invited for the sale of empty carton for the period of six months from the existing 8 FL-1 shops and newly opening FL-1 shops currently operating under the jurisdiction of Palakkad warehouse in the North-1 region of KSBC,,,Miscellaneous Services,,Item Rate,Palakkad,02-Jul-2026 05:00 PM,2026-07-02 17:00:00,"Regional Manager N1,KSBC","Regional Manager -N1 Office, Pope John 1st Block, Chiyyaram, Thrissur-680026"
PWD||Chief Engineer (Buildings)||SE Bldgs (S)||EE Bldgs (PTA)||AEE PWD Buildings Sub Division Pathanamthitta,PWD,1,https://etenders.kerala.gov.in/nicgep/app?component=%24DirectLink_0&page=FrontEndAdvancedSearchResult&service=direct&session=T&sp=S0XC57J3eHGXhbJpl4zkpag%3D%3D,2026_PWD_857097_1,Works,1,"7,898",700,295,DEPOSIT Painting and Interlock works in Govt Oldage Home Vayalathala Painting and Interlock works in Govt Oldage Home Vayalathala General Civil Work,DEPOSIT Painting and Interlock works in Govt Oldage Home Vayalathala Painting and Interlock works in Govt Oldage Home Vayalathala General Civil Work,"3,15,901",315901.0,Civil Works - Buildings,60,Item Rate,PATHANAMTHITTA,01-Jul-2026 03:00 PM,2026-07-01 15:00:00,ASSISTANTEXECUTIVEENGINEER,PWDBUILDINGSSUBDIVISIONPATHANAMTHITTA
Harbour Engineering Department||Harbour Engineering||SE (South circle),Harbour Engineering Department,1,https://etenders.kerala.gov.in/nicgep/app?component=%24DirectLink_0&page=FrontEndAdvancedSearchResult&service=direct&session=T&sp=SQxfEWiE0gaVPQ3PPOU2xlQ%3D%3D,2026_HED_857066_1,Works,1,"50,000","5,515","1,534",Right for removal of 10000 cum dredged sand deposited in the premises of Muthalapozhi fishing harbour by remitting the amount to Govt as per the condition prescribed by HED,Right for removal of 10000 cum dredged sand deposited in the premises of Muthalapozhi fishing harbour by remitting the amount to Govt as per the condition prescribed by HED,"1,38,98,300",13898300.0,Civil Works - Others,60,Item Rate,Muthalapozhi,29-Jun-2026 06:00 PM,2026-06-29 18:00:00,"Superintending Engineer, HarbourEngineering South","Superintending Engineer, HarbourEngineering South Circle, Kamaleswaram, Manacaud (PO), Thiruvananthapuram-9"
"Kerala Water Authority||Chief Engineer Southern Region (Trivandrum)||Superintending Engineer PH Circle Thiruvananthap||Executive Engineer P H Division (North) TVPM||AEE, WW West Pongommoodu",Kerala Water Authority,1,https://etenders.kerala.gov.in/nicgep/app?component=%24DirectLink_0&page=FrontEndAdvancedSearchResult&service=direct&session=T&sp=SquhN2%2BhF6u9SWvJpO01rxw%3D%3D,2026_KWA_857019_1,Works,1,"33,921","2,760",767,Replacement of Damaged Sections of Transmission Main-Replacement of the Exposed 900 mm Diameter MS Pipeline at Thattinakam Bridge,Replacement of the Exposed 900 mm Diameter MS Pipeline at Thattinakam Bridge,"13,56,828",1356828.0,Civil Works - Water Works,30,Item Rate,Thattinakam,29-Jun-2026 11:00 AM,2026-06-29 11:00:00,"SreekeshRAssistant Executive Engineer,WWWEST Subdi","SreekeshRAssistantExecutiveEngineer,WWWESTSubdivision,Pongummoodu"
"Kerala Water Authority||Chief Engineer Central Region (Kochi)||Superintending Engineer PH Circle Thrissur||Executive Engineer (PH Division Thrissur)||AEE ,WW Sub Division, Thrissur",Kerala Water Authority,1,https://etenders.kerala.gov.in/nicgep/app?component=%24DirectLink_0&page=FrontEndAdvancedSearchResult&service=direct&session=T&sp=SckptMDpM3%2BQiluRoc5jQvw%3D%3D,2026_KWA_857022_1,Works,1,"1,230",335,295,DEPOSIT Water connection for Homeo Dispensary SC Samsakarika Nilayam Parikkad 12th ward in Adat Anchayath Pipeline Work,DEPOSIT Water connection for Homeo Dispensary SC Samsakarika Nilayam Parikkad 12th ward in Adat Anchayath Pipeline Work,,,Civil Works - Water Works,30,Percentage,Parikkad Adat,29-Jun-2026 03:00 PM,2026-06-29 15:00:00,Assistant Executive Engineer Water works Sub divis,"Assistant Executive Engineer Water works Sub division,Kerala water Authority,Thrissur"
PWD||Chief Engineer (Roads and Bridges)||SE Roads (N)||EE Roads (KKD)||AEE Roads SD Koduvally,PWD,1,https://etenders.kerala.gov.in/nicgep/app?component=%24DirectLink_0&page=FrontEndAdvancedSearchResult&service=direct&session=T&sp=SEGmX7ePrXzPD79cwP13A7A%3D%3D,2026_PWD_857015_1,Works,1,"10,593",935,295,"GENERAL-Pre monsoon works - 2026-Clearing light jungle, chocked drains and culverts, cutting dangerously standing and fallen trees, removal of earth slips in various roads under Roads section, Koduvally","GENERAL-Pre monsoon works - 2026-Clearing light jungle, chocked drains and culverts, cutting dangerously standing and fallen trees, removal of earth slips in various roads under Roads section, Koduvally","4,23,723",423723.0,Civil Works - Roads,,Item Rate,koduvally,29-Jun-2026 03:00 PM,2026-06-29 15:00:00,Assistant Executive Engineer PWD Roads Sub Divisio,"PWD Roads Sub Division,Koduvally"
"Irrigation Department||CE(I and A)||SE,MIC,EKLM||EE,MI Div.,EKLM",Irrigation Department,1,https://etenders.kerala.gov.in/nicgep/app?component=%24DirectLink_0&page=FrontEndAdvancedSearchResult&service=direct&session=T&sp=S72%2ByHDcmXTonvfZnpLq46Q%3D%3D,2026_Irrig_857104_1,Works,1,"5,868",555,295,GENERAL Operation Vahini 2026 Removing obstructions and cleaning of Elavana Cherthanadu Thodu in Alanghad and Karumalloor Gramapanchayath General Civil Work,thodu desiltation,"2,34,703",234703.0,Civil Works - Others,90,Item Rate,Alangadu,26-Jun-2026 11:00 AM,2026-06-26 11:00:00,Assistant Execuitive Engineer,Assistant Execuitive Engineer MINOR IRRIGATION SUBDIVISION ALUVA
"Kerala Water Authority||Chief Engineer Central Region (Kochi)||Superintending Engineer PH Circle Thrissur||Executive Engineer (PH Division Thrissur)||AEE , PH Sub Division, Guruvayur",Kerala Water Authority,1,https://etenders.kerala.gov.in/nicgep/app?component=%24DirectLink_0&page=FrontEndAdvancedSearchResult&service=direct&session=T&sp=SjxDreqXL9Z87WZgmZyd%2Fcw%3D%3D,2026_KWA_856798_1,Works,1,"19,068","1,685",295,State Plan-2025-26-Guruvayur Drainage Scheme- Supply Installation Testing and Commissioning of Sewage Transfer pump set at Sewerage Treatment Plant Chakkamkandam Guruvayur-General Civil wORK,State Plan-2025-26-Guruvayur Drainage Scheme- Supply Installation Testing and Commissioning of Sewage Transfer pump set at Sewerage Treatment Plant Chakkamkandam Guruvayur-General Civil wORK,"7,62,712",762712.0,Civil Works - Water Works,180,Item Rate,GURUVAYUR,27-Jun-2026 03:00 PM,2026-06-27 15:00:00,Assistant Executive Engineer,"Assistant Executive Engineer PH Subdivision, Guruvayur"
Local Self Government Department||Kozhikode||Corporation Engineers Office Kozhikkode||Corporation Engineer Kozhikkode Corporation,Local Self Government Department,1,https://etenders.kerala.gov.in/nicgep/app?component=%24DirectLink_0&page=FrontEndAdvancedSearchResult&service=direct&session=T&sp=S2ZoAxqxaDO26siMMpnqhXw%3D%3D,2026_LSGD_857109_1,Works,1,"33,170","2,760",767,1828/26-Electrification of schools PHASE 2--Renovation of old building Kinassery GVHSS -Electrification-General Electrical Work,Please refer Tender document,"13,26,784",1326784.0,Electrical Works,90,Item Rate,Kozhikode Corporation,29-Jun-2026 06:00 PM,2026-06-29 18:00:00,SUPERINTENDING ENGINEER,"O/o SE, Kozhikode Corporation, Tle.0495-2365040"
Rural Development Department||Commissionerate for Rural Development||Asst Development Commissioner (General) Kozhikkode||Koduvally Block Panchayath,Rural Development Department,1,https://etenders.kerala.gov.in/nicgep/app?component=%24DirectLink_0&page=FrontEndAdvancedSearchResult&service=direct&session=T&sp=Spc1WglYEAfmx72TxJQEnbA%3D%3D,2026_CRD_857091_1,Works,1,"8,468",750,295,"Re-Tender MP-LADS-24-25 Repair Maintenance of Perilli SC Nagar Ummathamparambu SC Nagar Road, Ward 4, Omassery GP-In Koduvally BPGeneral Civil Wor","Re-Tender MP-LADS-24-25Repair Maintenance of Perilli SC Nagar Ummathamparambu SC Nagar Road, Ward 4, Omassery GP-In Koduvally BPGeneral Civil Wor","3,38,706",338706.0,Civil Works - Roads,180,Item Rate,KODUVALLY,29-Jun-2026 03:00 PM,2026-06-29 15:00:00,Block Development Officer,Block Development Officer Koduvally
"Kerala Water Authority||Chief Engineer Southern Region (Trivandrum)||Superintending Engineer PH Circle Thiruvananthap||Exec Engg (Water Supply Division Neyyattinkara)||AEE, WS Sub Division,Kanjiramkulam",Kerala Water Authority,1,https://etenders.kerala.gov.in/nicgep/app?component=%24DirectLink_0&page=FrontEndAdvancedSearchResult&service=direct&session=T&sp=Sc00XpBwXywqcDffsLHGw5A%3D%3D,2026_KWA_856583_1,Works,1,"20,680","1,825",295,Mace of WTPPeriodic Maintenance of 15 MLD WTP Raw water Pumphouse for Athiyanoor Kottukal Scheme at pongil for One year 2025 2026,Mace of WTPPeriodic Maintenance of 15 MLD WTP Raw water Pumphouse for Athiyanoor Kottukal Scheme at pongil for One year 2025 2026,,,Civil Works - Others,365,Item Rate,kanjiramkulam,30-Jun-2026 03:00 PM,2026-06-30 15:00:00,Assistant Executive Engineer,Office of the Assistant Executive Engineer WSSD Knjiramkulam
Kerala State Electricity Board||Chief Engineer (Distribution North)||Dpty Chief Engg Electrical Circle Kozhikode,Kerala State Electricity Board,1,https://etenders.kerala.gov.in/nicgep/app?component=%24DirectLink_0&page=FrontEndAdvancedSearchResult&service=direct&session=T&sp=SVZExfg9RDCt9AkQ7Lgb7Aw%3D%3D,2026_KSEB_857103_1,Works,1,"23,000","2,242",295,RECONDUCTORING HT LINE USING COVERED CONDUCTOR FROM KSIDC TO MANKAYAM UNDER ELECTRICAL SECTION UNNIKULAM,RECONDUCTORING HT LINE USING COVERED CONDUCTOR FROM KSIDC TO MANKAYAM UNDER ELECTRICAL SECTION UNNIKULAM,"9,17,780",917780.0,Electrical Works,,Percentage,UNNIKULAM,29-Jun-2026 05:00 PM,2026-06-29 17:00:00,EXECUTIVE ENGINEER,EXECUTIVE ENGINEER PMU KOZHIKODE VAIDYUTHI BHAVANAM
Kerala State Coastal Area Development Corporation,Kerala State Coastal Area Development Corporation,1,https://etenders.kerala.gov.in/nicgep/app?component=%24DirectLink_0&page=FrontEndAdvancedSearchResult&service=direct&session=T&sp=SbSMuZpLblde%2FAbumaKtMew%3D%3D,2026_SCADC_857105_1,Works,1,"27,000","2,950",767,Fisheries Renovation work of Mess Building for GRFTHS Arthunkal in Alappuzha District General Civil Work,Fisheries Renovation work of Mess Building for GRFTHS Arthunkal in Alappuzha District General Civil Work,"10,68,082",1068082.0,Civil Works - Buildings,60,Item Rate,Arthunkal in Alappuzha District,29-Jun-2026 05:00 PM,2026-06-29 17:00:00,"CHIEF ENGINEER, KSCADC","KSCADC Building, Kamalewsaram , Manacaud P.O. Thiruvananthapuram Pin-695009"
Kerala Rural Water Supply and Sanitation Agency||RPMU Idukki,Kerala Rural Water Supply and Sanitation Agency,1,https://etenders.kerala.gov.in/nicgep/app?component=%24DirectLink_0&page=FrontEndAdvancedSearchResult&service=direct&session=T&sp=SizRzZJvD3lvQfm96FzY0zA%3D%3D,2026_KRWSA_834625_4,Works,1,"10,600",900,295,Rectification Works of 1 no Small Water Supply Schemes Under Package-2 to Parathode GramaPanchayath in Kottayam District,Rectification Works of 1 no Small Water Supply Schemes Under Package-2 to Parathode GramaPanchayath in Kottayam District,"4,23,722",423722.0,Civil Works - Water Works,90,Item Rate,Parathode Grama Panchayath in Kottayam District,01-Jul-2026 05:00 PM,2026-07-01 17:00:00,"Regional project Director,Regional project managem","REGIONAL PROJECT DIRECTOR,REGIONAL PROJECT MANAGEMENT UNIT,KRWSA, MATHA ARCADE, THODUPUZHA, IDUKKI - 685584"
PWD||Chief Engineer (Buildings)||SE Bldgs (S)||EE Bldgs (TVM)||AEE BldgsSD Neyyattinkara,PWD,1,https://etenders.kerala.gov.in/nicgep/app?component=%24DirectLink_0&page=FrontEndAdvancedSearchResult&service=direct&session=T&sp=S4wliEYR0lz%2B0t%2FwkGlyIQQ%3D%3D,2026_PWD_857080_1,Works,1,"6,353",560,295,"-Renovation of Toilet at IHRD of Applied Science, Dhanuvachapuram-","GENERAL-Renovation of Toilet at IHRD College of Applied Science, Dhanuvachapuram-General-General Civil Work","2,54,131",254131.0,Civil Works - Buildings,,Item Rate,Neyyattinkara,01-Jul-2026 05:00 PM,2026-07-01 17:00:00,Assistant Executive Engineer,"O/o the Assistant Executive Engineer, PWD, Buildings Sub Division Neyyattinkara"
Forest Department||Wildlife Division Silent Valley National Park,Forest Department,1,https://etenders.kerala.gov.in/nicgep/app?component=%24DirectLink_0&page=FrontEndAdvancedSearchResult&service=direct&session=T&sp=SJRW98RJ%2FK%2FinpyIH5zESJg%3D%3D,2026_FD_850674_2,Works,2,"9,000",720,295,Patch work at various areas of concreted Mukkali Sairandri road under Bhavani Range during 2026-27,Patch work at various areas of concreted Mukkali Sairandri road under Bhavani Range during 2026-27,"3,60,000",360000.0,Civil Works - Roads,30,Percentage,Mukkali -Sairandri road,06-Jul-2026 06:00 PM,2026-07-06 18:00:00,"Wildlife Warden, Silent Valley","Office of the Wildlife Warden, Silent Valley Division,Mannarkkad -678582"
PWD||Chief Engineer (Roads and Bridges)||SE Roads (S),PWD,1,https://etenders.kerala.gov.in/nicgep/app?component=%24DirectLink_0&page=FrontEndAdvancedSearchResult&service=direct&session=T&sp=SwNAM2PPP2Obk%2FgdtJa21jw%3D%3D,2024_PWD_695284_4,Works,1,"50,000","2,760","1,534",B W 2018 19 Improvements to Komenkerychira Ambedkar colony road ch 1 000 to 3 800 Balance Work,B W 2018 19 Improvements to Komenkerychira Ambedkar colony road ch 1 000 to 3 800 Balance Work,"97,63,195",9763195.0,Civil Works - Roads,120,Item Rate,Komenkerichira,30-Jun-2026 05:00 PM,2026-06-30 17:00:00,"Superintending Engineer, PWD Roads South Circle, T","SE Roads, TVM"
Guruvayur Devaswom,Guruvayur Devaswom,1,https://etenders.kerala.gov.in/nicgep/app?component=%24DirectLink_0&page=FrontEndAdvancedSearchResult&service=direct&session=T&sp=SuZv%2Fme%2FbgYluo0cCjp9Gyg%3D%3D,2026_GD_854039_2,Works,1,"38,100","3,360",767,Temporary Electrical illumination in connection with various annual festivals of Sreekrishna temple Guruvayur for the year 2026-2027,Temporary Electrical illumination in connection with various annual festivals of Sreekrishna temple Guruvayur for the year 2026-2027,,,Electrical Works,365,Item Rate,Guruvayur,03-Jul-2026 03:00 PM,2026-07-03 15:00:00,Executive Engineer Electrical,"Power House, Sreepadmam, Guruvayur Devaswom, Guruvayur."
PWD||Chief Engineer (Buildings)||SE Bldgs (N)||EE Bldgs (MPM)||AEE Bldgs SD Manjeri,PWD,1,https://etenders.kerala.gov.in/nicgep/app?component=%24DirectLink_0&page=FrontEndAdvancedSearchResult&service=direct&session=T&sp=S4tLPZ59DJhp5Ntep6xNeMg%3D%3D,2026_PWD_857095_1,Works,1,"9,107",805,295,"GENERAL-Running contract for Rest house Manjeri, Edavanna, Areekod for the year 2026- 2027-Running contract for Rest house Manjeri, Edavanna, Areekod for the year 2026-2027-General Civil Work","GENERAL-Running contract for Rest house Manjeri, Edavanna, Areekod for the year 2026- 2027-Running contract for Rest house Manjeri, Edavanna, Areekod for the year 2026-2027-General Civil Work","3,64,281",364281.0,Civil Works - Buildings,365,Item Rate,"GENERAL-Running contract for Rest house Manjeri, E",01-Jul-2026 11:00 AM,2026-07-01 11:00:00,Assistant Executive Engineer,"AEE PWD Buildings Sub div.Cherani,Manjeri"
Forest Department||Wildlife Division Silent Valley National Park,Forest Department,1,https://etenders.kerala.gov.in/nicgep/app?component=%24DirectLink_0&page=FrontEndAdvancedSearchResult&service=direct&session=T&sp=SlyXydnMCT0do0%2FqYacH%2BbQ%3D%3D,2026_FD_850274_2,Works,2,"2,000",500,295,Cost of false ceiling work in Anganavadi building at Thazhe Thudukki Oru under Thudukki FS under bhavnai range during 2026-27,Cost of false ceiling work in Anganavadi building at Thazhe Thudukki Oru under Thudukki FS under bhavnai range during 2026-27,"80,000",80000.0,Civil Works - Others,30,Item Rate,Thazhe Thudukki,06-Jul-2026 06:00 PM,2026-07-06 18:00:00,"Wildlife Warden, Silent Valley","Office of the Wildlife Warden, Silent Valley Division, Mannarkakd-678582"
PWD||Chief Engineer (Roads and Bridges)||SE Roads (N)||EE Roads (KKD)||AEE Roads SD Koduvally,PWD,1,https://etenders.kerala.gov.in/nicgep/app?component=%24DirectLink_0&page=FrontEndAdvancedSearchResult&service=direct&session=T&sp=SKb%2BhAyuJIeMaa%2Fi759GaFA%3D%3D,2026_PWD_840471_4,Works,1,"22,651","2,000",295,GENERAL-Construction of drainage slab inbetween at chainage 26/600 to 27/000 RHS Kappad Thusharagiri Adivaram Road - Narikkuni section -General Civil Work,GENERAL-Construction of drainage slab inbetween at chainage 26/600 to 27/000 RHS Kappad Thusharagiri Adivaram Road - Narikkuni section -General Civil Work,"9,06,033",906033.0,Civil Works - Roads,90,Item Wise,koduvally,29-Jun-2026 02:00 PM,2026-06-29 14:00:00,Assistant Executive Engineer PWD Roads Sub Divisio,"O/o Office of the Assistant Executive Engineer, Roads Sub Division Koduvally"
PWD||Chief Engineer (Roads and Bridges)||SE Roads (S)||EE Roads (ALP),PWD,1,https://etenders.kerala.gov.in/nicgep/app?component=%24DirectLink_0&page=FrontEndAdvancedSearchResult&service=direct&session=T&sp=Sq4pIwf0lUuJXOP3s%2FMl2MQ%3D%3D,2026_PWD_857016_1,Works,1,"50,000","2,760",767,LAC-ADS-LAC ADS of KayamkulamLACProviding 40mm MSS to Mavoli Junction to Sastham Koickal Junction road from 0/000 to 0/420 in Chettikulangara Grama Panchayath- Work-General Civil Work,LAC-ADS-LAC ADS of KayamkulamLACProviding 40mm MSS to Mavoli Junction to Sastham Koickal Junction road from 0/000 to 0/420 in Chettikulangara Grama Panchayath- Work-General Civil Work,"23,47,195",2347195.0,Civil Works - Roads,365,Item Rate,Alappuzha,29-Jun-2026 05:00 PM,2026-06-29 17:00:00,Executive Engineer,Executive Engineer Roads Division Allappuzha
PWD||Chief Engineer (Roads and Bridges)||SE Roads (N)||EE Roads (KKD)||AEE Roads SD Koduvally,PWD,1,https://etenders.kerala.gov.in/nicgep/app?component=%24DirectLink_0&page=FrontEndAdvancedSearchResult&service=direct&session=T&sp=SiR8kN8GfXD8lHwEufK5Azg%3D%3D,2026_PWD_832797_5,Works,1,"16,655","1,470",295,GENERAL- TRAFFIC SAFETY WORK FOR KUMMANGOTTUTHAZHAM -II-- PANDARAPARAMBU ROAD CH 4/900 TO 5/567-General Civil Work-,GENERAL- TRAFFIC SAFETY WORK FOR KUMMANGOTTUTHAZHAM -II-- PANDARAPARAMBU ROAD CH 4/900 TO 5/567-General Civil Work-,"6,66,213",666213.0,Civil Works - Roads,90,Item Rate,koduvally,29-Jun-2026 02:00 PM,2026-06-29 14:00:00,Assistant Executive Engineer PWD Roads Sub Divisio,"O/o Office of the Assistant Executive Engineer, Roads Sub Division Koduvally"
Kerala State Electricity Board||Chief Engineer (Distribution South)||Dpty Chief Engg Electrical Circle Kollam||EE Electrical Div Karunagappally||AEE Electrical Sub Division Oachira,Kerala State Electricity Board,1,https://etenders.kerala.gov.in/nicgep/app?component=%24DirectLink_0&page=FrontEndAdvancedSearchResult&service=direct&session=T&sp=SiKGbHtI0UxE9cBAfLyCG6A%3D%3D,2026_KSEB_857088_1,Works,1,500,472,295,"Hiring a Taxi jeep or equivalent vehicle (below 1500 CC) less than 15 years old, with experienced driver, fuel etc for the use of Electrical section Thevalakkara for one year (1750 km/month).","Hiring a Taxi jeep or equivalent vehicle (below 1500 CC) less than 15 years old, with experienced driver, fuel etc for the use of Electrical section Thevalakkara for one year (1750 km/month).","5,97,000",597000.0,Electrical and Maintenance Works,365,Item Wise,KSEB Electrical Section Office Thevalakkara,30-Jun-2026 11:00 AM,2026-06-30 11:00:00,Executive Engineer,"O/o Executive Engineer,KSEB Electrical Division ,Karunagappally,Highschool Junction, Karunagappally"
INKEL Limited,INKEL Limited,1,https://etenders.kerala.gov.in/nicgep/app?component=%24DirectLink_0&page=FrontEndAdvancedSearchResult&service=direct&session=T&sp=SVotD53Uwx19UvaX5gn7LAw%3D%3D,2026_INKEL_857090_1,Works,1,"50,000","2,950",767,"Construction of New Hospital Block at District Hospital, Mavelikkara (SH Supply of Chairs)",Supply of Chairs,"36,71,534",3671534.0,Miscellaneous Works,90,Item Rate,"District Hospital, Mavelikkara",06-Jul-2026 03:00 PM,2026-07-06 15:00:00,"Managing Director, INKEL Limited","1st Floor, Ajiyal Complex, Post Office Road, Kakkanad, Cochin - 682030"
