organisation_chain_raw,organisation_name,tender_active,tender_url,tender_id,tender_category,no_of_covers,emd_amount,tender_fee,processing_fee,title,work_description,tender_value,tender_value_num,product_category,period_of_work_days,form_of_contract,location,bid_submission_end_date,bid_end_iso,tender_inviting_authority,authority_address
Local Self Government Department||Thiruvananthapuram||Corporation Engineers Office TVM||Thiruvananthapuram Corporation,Local Self Government Department,1,https://etenders.kerala.gov.in/nicgep/app?component=%24DirectLink_0&page=FrontEndAdvancedSearchResult&service=direct&session=T&sp=SW%2BoWwxS4ZZTOGhVKFmsv4g%3D%3D,2026_LSGD_857125_6,Works,1,"19,017","1,680",295,27064-2026 GENERAL-pre monsoon maintenance to drainage lines-construction of culvert at Benedict Nagar- punnaram thoppu road and chenchery kurukulam road in Mannanthala ward at Ulloor zonal-General Civil Work,27064-2026 GENERAL-pre monsoon maintenance to drainage lines-construction of culvert at Benedict Nagar- punnaram thoppu road and chenchery kurukulam road in Mannanthala ward at Ulloor zonal-General Civil Work,"7,60,671",760671.0,Civil Works - Roads,60,Item Wise,Thiruvananthapuram Corporation,30-Jun-2026 06:00 PM,2026-06-30 18:00:00,Superintending Engineer,"O/O Superintending Engineer, LID and EW Thiruvananthapuram Corporation"
Kerala State Electronics Development Corp Ltd||Keltron Equipment Complex,Kerala State Electronics Development Corp Ltd,1,https://etenders.kerala.gov.in/nicgep/app?component=%24DirectLink_0&page=FrontEndAdvancedSearchResult&service=direct&session=T&sp=SdH4owg42H7ll%2FLh2ysn2SA%3D%3D,2026_KSEDC_857243_1,Goods,2,"20,203","3,030",295,SUPPLY OF DISPLAY BOX ASSEMBLY FOR ESV3-1 PROJECT,SUPPLY OF DISPLAY BOX ASSEMBLY FOR ESV3-1 PROJECT,,,Equipments,,Item Rate,KEC KARAKULAM,02-Jul-2026 06:00 PM,2026-07-02 18:00:00,HEAD PURCHASE,"Keltron Equipment Complex Karakulam, Trivandrum"
Forest Department||Deputy Director (Periyar West) Division Peermade,Forest Department,1,https://etenders.kerala.gov.in/nicgep/app?component=%24DirectLink_0&page=FrontEndAdvancedSearchResult&service=direct&session=T&sp=SPsrW8tFcRShqFNVwnz95Vw%3D%3D,2026_FD_857319_1,Works,2,"11,605","1,150",295,Construction of Toilet Block for Kandankayam EDC in Moozhickal Section under Azhutha Range.,Construction of Toilet Block for Kandankayam EDC in Moozhickal Section under Azhutha Range.,"4,64,067",464067.0,Civil Works - Buildings,60,Percentage,Kandankayam in Moozhickal EDC,01-Jul-2026 05:00 PM,2026-07-01 17:00:00,Deputy Director,"Deputy Director , Periyar Tiger Reserve West Division , Peermade 685531"
PWD||Chief Engineer (Buildings)||SE Bldgs (S)||EE Bldgs (ALP)||AEE BldgsSD Alappuzha,PWD,1,https://etenders.kerala.gov.in/nicgep/app?component=%24DirectLink_0&page=FrontEndAdvancedSearchResult&service=direct&session=T&sp=SPkfKsduV8ddm8rCqtYMMhg%3D%3D,2026_PWD_855721_2,Works,1,"6,350",560,295,"GENERAL-Running Contract 2026-27- Maintenance work for Family Court ,Alappuzha - General Civil Work","GENERAL-Running Contract 2026-27- Maintenance work for Family Court ,Alappuzha - General Civil Work","2,53,990",253990.0,Civil Works - Buildings,365,Item Rate,Alappuzha,01-Jul-2026 05:00 PM,2026-07-01 17:00:00,Assistant Executive Engineer,Assistant Executive Engineer PWD Buildings Subdivision Alappuzha
Kerala State Electricity Board||Kerala Hydel Tourism Centre,Kerala State Electricity Board,1,https://etenders.kerala.gov.in/nicgep/app?component=%24DirectLink_0&page=FrontEndAdvancedSearchResult&service=direct&session=T&sp=SUzW4IwGSa3Y98%2B3wJoEUtg%3D%3D,2026_KSEB_857332_1,Services,1,"25,000",590,295,"Letting out Space on monthly revenue sharing basis for running Virtual Reality adventure centre for a period of 2 Years at Hydel Park, Munnar and Dew Valley Boating Centre, Sengulam","Letting out Space on monthly revenue sharing basis for running Virtual Reality adventure centre for a period of 2 Years at Hydel Park, Munnar and Dew Valley Boating Centre, Sengulam",,,Miscellaneous Services,,Percentage,Munnar,08-Jul-2026 12:30 PM,2026-07-08 12:30:00,"The Director , KHTC","Vydhuthi Bhavanam, Pattom, TVM"
Forest Department||Deputy Director (Periyar West) Division Peermade,Forest Department,1,https://etenders.kerala.gov.in/nicgep/app?component=%24DirectLink_0&page=FrontEndAdvancedSearchResult&service=direct&session=T&sp=SQkU2Oi4rLzxIynL49ebb9A%3D%3D,2026_FD_855289_2,Goods,2,"4,200",590,295,Supply and Installation of camera (with specification as per BOQ) for Real Time Monitoring system at Uppupara and Zero Point under Azhutha Range under Periyar West Division during 2026-27.,Supply and Installation of camera (with specification as per BOQ) for Real Time Monitoring system at Uppupara and Zero Point under Azhutha Range under Periyar West Division during 2026-27.,"1,68,000",168000.0,Equipments,30,Percentage,Azhutha Range,01-Jul-2026 05:00 PM,2026-07-01 17:00:00,Deputy Director,"Deputy Director, Periyar Tiger Reserve West Division , Peermade 685531"
PWD||Chief Engineer (Buildings)||SE Bldgs (S)||EE Bldgs (TVM),PWD,1,https://etenders.kerala.gov.in/nicgep/app?component=%24DirectLink_0&page=FrontEndAdvancedSearchResult&service=direct&session=T&sp=SMsskUVn%2BTjVRGa1DF7%2Fm4Q%3D%3D,2026_PWD_853622_2,Works,1,"50,000","2,760",767,Deposit-Construction of Lift Pareeksha Bhavan Construction of new Lift at Pareekshabhavan Poojappura Civil work,Deposit-Construction of Lift Pareeksha Bhavan Construction of new Lift at Pareekshabhavan Poojappura Civil work,"21,18,499",2118499.0,Civil Works - Buildings,180,Item Rate,Thiruvananthapuram,03-Jul-2026 05:00 PM,2026-07-03 17:00:00,Executive Engineer,PWD Buildings Division Thiruvananthapuram
Forest Department||Deputy Director (Periyar West) Division Peermade,Forest Department,1,https://etenders.kerala.gov.in/nicgep/app?component=%24DirectLink_0&page=FrontEndAdvancedSearchResult&service=direct&session=T&sp=SK3xcIM43VqxlGMcmG8cLbQ%3D%3D,2026_FD_857326_1,Works,2,"18,690","1,855",295,Construction of Tower for Real Time Monitoring System at Pampamala in Pachakkanam FS during 2026-27 .,Construction of Tower for Real Time Monitoring System at Pampamala in Pachakkanam FS during 2026-27 .,"7,47,430",747430.0,Civil Works - Others,120,Percentage,Pachakkanm in Pampa Range,01-Jul-2026 05:00 PM,2026-07-01 17:00:00,Deputy Director,"Deputy Director, Periyar Tiger Reserve West Diviion , Peermade 685531"
PWD||Chief Engineer (Buildings)||SE Bldgs (S)||EE Bldgs (PTA)||AEE Buildings SD Thiruvalla,PWD,1,https://etenders.kerala.gov.in/nicgep/app?component=%24DirectLink_0&page=FrontEndAdvancedSearchResult&service=direct&session=T&sp=Sh9TAWOqry40d9EE5GnSUQg%3D%3D,2026_PWD_857325_1,Works,1,"4,549",555,295,GENERAL One year Running contract work at Village Offices under Vennikulam Section Village office Anicadu Village office Mallappally Village office Kalloopara Village office Perumpetty Village office Thelliyoor RC Work for the year 2026 2027 Gene,GENERAL One year Running contract work at Village Offices under Vennikulam Section Village office Anicadu Village office Mallappally Village office Kalloopara Village office Perumpetty Village office Thelliyoor RC Work for the year 2026 2027 Gene,"1,81,963",181963.0,Civil Works - Buildings,365,Item Rate,Thiruvalla,01-Jul-2026 11:30 AM,2026-07-01 11:30:00,Assistant Executive Engineer,PWD Buildings Subdivision Thiruvalla
Kerala State Electricity Board||Kerala Hydel Tourism Centre,Kerala State Electricity Board,1,https://etenders.kerala.gov.in/nicgep/app?component=%24DirectLink_0&page=FrontEndAdvancedSearchResult&service=direct&session=T&sp=S%2FEULOKscpxZLe%2BctUB2rtg%3D%3D,2026_KSEB_857305_1,Services,1,"25,000",590,295,"Letting out Space on monthly revenue sharing basis for running 360-Degree Video Booth for a period of 2 Years at Hydel Park, Munnar and Dew Valley Boating Centre, Sengulam","Letting out Space on monthly revenue sharing basis for running 360-Degree Video Booth for a period of 2 Years at Hydel Park, Munnar and Dew Valley Boating Centre, Sengulam",,,Miscellaneous Services,30,Percentage,Munnar,08-Jul-2026 12:00 PM,2026-07-08 12:00:00,"The Director , KHTC","Vydhuthi Bhavanam pattom, TVM"
Directorate of Urban Affairs||Regional Joint Director Kochi||Secretary Angamali Municipality,Directorate of Urban Affairs,1,https://etenders.kerala.gov.in/nicgep/app?component=%24DirectLink_0&page=FrontEndAdvancedSearchResult&service=direct&session=T&sp=SrEjVUYVS7WoaAvJW75n2EQ%3D%3D,2026_UAD_857283_1,Goods,1,0.00,0.00,295,KSWMP IEC Activity-Supply and installation of Sign Boards,KSWMP IEC Activity-Supply and installation of Sign Boards -Angamali Municipality,,,Hardware,30,Item Rate,Angmaly Municipality,15-Jul-2026 03:00 PM,2026-07-15 15:00:00,Clean City Manager,Municipal Office Angamaly
Kerala State Electricity Board||Chief Engineer (Transmission North)||Dpty Chief Engg Trans Circle Kozhikkode||EE Trans Div Kaniyampetta,Kerala State Electricity Board,1,https://etenders.kerala.gov.in/nicgep/app?component=%24DirectLink_0&page=FrontEndAdvancedSearchResult&service=direct&session=T&sp=S%2Bs8aKhg6jXWuomwDwx5aEw%3D%3D,2026_KSEB_857324_1,Works,1,"31,600","3,068",767,Construction of 110 kV substation Adivaram- Casting and laying of cover slab for various trenches in the yard and Construction of Drainage in the yard,Earthwork excavation PCC RCC Centering and shuttering Steel reinforcement for RCC Filling available excavated earth Plastering Solid block masonry Conveying the newly casted slabs from casting yard,"12,60,708",1260708.0,Civil Works - Others,30,Percentage,110 kV substation Adivaram,02-Jul-2026 04:00 PM,2026-07-02 16:00:00,Assistant Executive Engineer,"Transmission Subdivision, Thamarassery"
PWD||Chief Engineer (Buildings)||SE Bldgs (N)||EE Bldgs (KKD)||AEE Spl BldgsSD Kozhikkode,PWD,1,https://etenders.kerala.gov.in/nicgep/app?component=%24DirectLink_0&page=FrontEndAdvancedSearchResult&service=direct&session=T&sp=Shp9zG%2Bn7FeTALqvnfhcYpQ%3D%3D,2026_PWD_857246_1,Works,1,"14,193","1,255",295,GENERAL Premonsoon Dental college 2026 27 General Civil Work,GENERAL Premonsoon Dental college 2026 27 General Civil Work,"5,67,713",567713.0,Civil Works - Buildings,180,Item Rate,Kozhikode,01-Jul-2026 03:00 PM,2026-07-01 15:00:00,Assistant executive engineer,PWD special buildings subdivision kozhikode
Kerala State Electricity Board||Chief Engineer (Transmission North)||Dpty Chief Engg Trans Circle Palakkad||EE Trans Div Shornur||AEE Transmission Subdivision Shornur,Kerala State Electricity Board,1,https://etenders.kerala.gov.in/nicgep/app?component=%24DirectLink_0&page=FrontEndAdvancedSearchResult&service=direct&session=T&sp=ScIXIiNSKewsjiJ9iEpR6ww%3D%3D,2026_KSEB_857247_1,Works,1,"50,000","5,900",767,Refurbishing of existing plate earthing system with Earth-mat in lower yard at 110 kV Substation Koppam,Refurbishing of existing plate earthing system with Earth-mat in lower yard at 110 kV Substation Koppam,"25,60,998",2560998.0,Electrical Works,,Percentage,KSEB 110 kV Substation Koppam,07-Jul-2026 04:00 PM,2026-07-07 16:00:00,AEE TSD Pattambi,"Office of the Assistant Executive Engineer, KSEBL, Transmission Subdivision, Pattambi, Maruthur (P.O), Palakkad-679306"
PWD||Chief Engineer (Buildings)||SE Bldgs (N)||EE Bldgs (KKD)||AEE Spl BldgsSD Kozhikkode,PWD,1,https://etenders.kerala.gov.in/nicgep/app?component=%24DirectLink_0&page=FrontEndAdvancedSearchResult&service=direct&session=T&sp=S38ds3j2u2ky16YTkDM9Few%3D%3D,2026_PWD_857257_1,Works,1,"12,706","1,125",295,GENERAL Premonsoon 2026 27 Premonsoon works at various wards attached to Govt.Mental Hospital Kuthiravattam Kozhikode General Civil Work,GENERAL Premonsoon 2026 27 Premonsoon works at various wards attached to Govt.Mental Hospital Kuthiravattam Kozhikode General Civil Work,"5,08,256",508256.0,Civil Works - Buildings,180,Item Rate,Kozhikode,01-Jul-2026 03:00 PM,2026-07-01 15:00:00,Assistant executive engineer,PWD special buildings sub division kozhikode.
Indian Institute of Handloom Technology,Indian Institute of Handloom Technology,1,https://etenders.kerala.gov.in/nicgep/app?component=%24DirectLink_0&page=FrontEndAdvancedSearchResult&service=direct&session=T&sp=SmbzuUyMw1b5NajO%2F1Atqfg%3D%3D,2026_IIHT_855792_1,Works,1,0.00,"1,770",295,"Request for Expression of Interest (EOI) for identifying preparation of Detailed Project Report (DPR) of KANHIRODE SAMAGRA KAITHARI NEYTHU GRAMAM at Koodali, Kannur District in Kerala","Request for Expression of Interest (EOI) for identifying preparation of Detailed Project Report (DPR) of KANHIRODE SAMAGRA KAITHARI NEYTHU GRAMAM at Koodali, Kannur District in Kerala",0.00,0.0,Miscellaneous Works,90,EOI,KANHIRODE SAMAGRA KAITHARI NEYTHU GRAMAM Koodali,07-Jul-2026 06:30 PM,2026-07-07 18:30:00,The Executive Director,"Indian Institute of Handloom Technology, Kannur 670007"
"Irrigation Department||CE,KTTND||SE,KDC, CHNGNR||EE,MI Div.,CHGNR",Irrigation Department,1,https://etenders.kerala.gov.in/nicgep/app?component=%24DirectLink_0&page=FrontEndAdvancedSearchResult&service=direct&session=T&sp=SWJDBrD9MP25403PbvK8srw%3D%3D,2026_Irrig_850472_4,Works,1,"7,935",700,295,GENERAL Pachilavel iSoil Investigation Improvements Agricultural facilities in Ilayasseri and Pachilaveli padasekharams in Budhanoor PanchayathInvestigation Work,GENERAL Pachilavel iSoil Investigation Improvements Agricultural facilities in Ilayasseri and Pachilaveli padasekharams in Budhanoor PanchayathInvestigation Work,"3,17,388",317388.0,Civil Works - Others,180,Item Rate,Budhanoor,03-Jul-2026 04:00 PM,2026-07-03 16:00:00,AEE,"AEE,MISD CGNR"
PWD||Chief Engineer (Buildings)||SE Bldgs (S)||EE Bldgs (KTM)||AEE Bldgs SD Kottayam,PWD,1,https://etenders.kerala.gov.in/nicgep/app?component=%24DirectLink_0&page=FrontEndAdvancedSearchResult&service=direct&session=T&sp=ShxQsnwdjCrog80DeCn%2Foxg%3D%3D,2026_PWD_857293_1,Works,1,"20,125","1,775",295,GENERAL-Running contract for Munsiff and Judicial courts-Running contract for Munsiff and Judicial courts-General Civil Work,"Estimate prepared for the yearly maintenance of Munsiff and Judicial courts. The items included in the estimate are for Repair work in roof ,plumbing,tile work, plastering etc","8,05,009",805009.0,Civil Works - Buildings,365,Item Rate,Changanassery,04-Jul-2026 11:00 AM,2026-07-04 11:00:00,Assistant Executive Engineer,PWD Building Subdivision Kottayam
Kerala Industrial Infrastructure Development Corp,Kerala Industrial Infrastructure Development Corp,1,https://etenders.kerala.gov.in/nicgep/app?component=%24DirectLink_0&page=FrontEndAdvancedSearchResult&service=direct&session=T&sp=STkB%2F3PdUVjqkXtIC%2F%2FvMeA%3D%3D,2026_KINFR_857294_1,Services,2,"50,000","2,950",767,"Maintenance of landscaping at KINFRA Techno Industrial Park, Kakkanchery for a period of three years","Maintenance of landscaping at KINFRA Techno Industrial Park, Kakkanchery for a period of three years","28,01,700",2801700.0,AMC/ Maintenance Contracts,1095,Item Rate,"Kakkanchery, Malappuram",07-Jul-2026 04:00 PM,2026-07-07 16:00:00,"Managing Director, KINFRA","KINFRA House, TC 31/2312, Sasthamangalam, Trivandrum"
PWD||Chief Engineer (Buildings)||SE Bldgs (S)||EE Bldgs (PTA)||AEE Buildings SD Thiruvalla,PWD,1,https://etenders.kerala.gov.in/nicgep/app?component=%24DirectLink_0&page=FrontEndAdvancedSearchResult&service=direct&session=T&sp=SS6bTeMMBDFBC2N%2BQ2VBDiw%3D%3D,2026_PWD_857286_1,Works,1,"8,177",725,295,"GENERAL Kannassa Smaraka Govt HSS school Kadapra, Pathanamthitta General Education Annual Plan 2025 26 Construction of school building for UP High School wing of the Kannassa Smaraka Government Higher Secondary School Kadapra Pathanamthitta Soil I","GENERAL Kannassa Smaraka Govt HSS school Kadapra, Pathanamthitta General Education Annual Plan 2025 26 Construction of school building for UP High School wing of the Kannassa Smaraka Government Higher Secondary School Kadapra Pathanamthitta Soil I","3,27,064",327064.0,Civil Works - Buildings,90,Item Rate,Thiruvalla,30-Jun-2026 11:00 AM,2026-06-30 11:00:00,Assistant Executive Engineer,PWD Buildings Subdivision Thiruvalla
Steel Industrials Kerala Ltd,Steel Industrials Kerala Ltd,1,https://etenders.kerala.gov.in/nicgep/app?component=%24DirectLink_0&page=FrontEndAdvancedSearchResult&service=direct&session=T&sp=SW6PBng%2Bp8Lvzvr7JvJ6wug%3D%3D,2026_SILK_857310_1,Works,2,"50,000","2,950",767,"Renovation work of Priya Road (Second Stage) in Chungathara GP, Malappuram (Project No.514/26)","Renovation work of Priya Road (Second Stage) in Chungathara GP, Malappuram (Project No.514/26)","35,72,511",3572511.0,Miscellaneous Works,180,Item Rate,Chungathara,30-Jun-2026 04:00 PM,2026-06-30 16:00:00,Manager (PED),"STEEL INDUSTRIALS KERALA LTD.ATHANI P.O,THRISSUR- 680 581"
PWD||Chief Engineer (Buildings)||SE Bldgs (S)||EE Bldgs (KLM)||Building Subdivision Kollam,PWD,1,https://etenders.kerala.gov.in/nicgep/app?component=%24DirectLink_0&page=FrontEndAdvancedSearchResult&service=direct&session=T&sp=SLW6Y4xQtXWFWNajaUzGssw%3D%3D,2026_PWD_857291_1,Works,1,"3,777",555,295,"GENERAL-Urgent-Installation of Water Treatment Filter at PWD Rest House, KundaraInstallation of Water Treatment Filter at PWD Rest House, Kundara-General Civil Work","GENERAL-Urgent-Installation of Water Treatment Filter at PWD Rest House, KundaraInstallation of Water Treatment Filter at PWD Rest House, Kundara-General Civil Work","1,51,097",151097.0,Civil Works - Buildings,90,Service,Kollam,30-Jun-2026 05:00 PM,2026-06-30 17:00:00,Assistant Executive Engineer,Assistant Executive Engineer PWD Buildings Sub division kollam
PWD||Chief Engineer (Roads and Bridges)||SE Roads (N)||EE Roads (KNR),PWD,1,https://etenders.kerala.gov.in/nicgep/app?component=%24DirectLink_0&page=FrontEndAdvancedSearchResult&service=direct&session=T&sp=SIVIXACEParFbI3TYt1vy8w%3D%3D,2026_PWD_857298_1,Works,1,"50,000","2,760",767,GENERAL-Budget 2019 -20 (20) Iverkulam Town Beautification and Infrastructure Development-Dharmadam Constituency General Civil Work,GENERAL-Budget 2019 -20 (20) Iverkulam Town Beautification and Infrastructure Development-Dharmadam Constituency General Civil Work,"45,75,632",4575632.0,Civil Works - Roads,180,Item Rate,Kannnur,30-Jun-2026 04:00 PM,2026-06-30 16:00:00,"Executive Engineer, Roads Division, Kannur","o/o Executive Engineer, Roads Division, Kannur"
PWD||Chief Engineer (Buildings)||SE Bldgs (S)||EE Bldgs (PTA)||AEE Buildings SD Thiruvalla,PWD,1,https://etenders.kerala.gov.in/nicgep/app?component=%24DirectLink_0&page=FrontEndAdvancedSearchResult&service=direct&session=T&sp=SXYGiXWPkMTUIxVg0V%2BehXQ%3D%3D,2026_PWD_857308_1,Works,1,"4,224",555,295,GENERAL Soil Investigation And Total Station work of Puthussery Govt L P School civil work Investigation Work,GENERAL Soil Investigation And Total Station work of Puthussery Govt L P School civil work Investigation Work,"1,68,978",168978.0,Civil Works - Buildings,90,Item Rate,Thiruvalla,30-Jun-2026 11:00 AM,2026-06-30 11:00:00,Assistant Executive Engineer,PWD Buildings Subdivision Thiruvalla
PWD||Chief Engineer (Roads and Bridges)||SE Roads (N)||EE Roads (KNR),PWD,1,https://etenders.kerala.gov.in/nicgep/app?component=%24DirectLink_0&page=FrontEndAdvancedSearchResult&service=direct&session=T&sp=S6T8Hm48b7ankRlby16RgFw%3D%3D,2026_PWD_857290_1,Works,1,"50,000","2,760",767,GENERAL-Budget 2019-20 (20) Panerichal Town Beautification and Infrastructure Development.-Works-General Civil Work,GENERAL-Budget 2019-20 (20) Panerichal Town Beautification and Infrastructure Development.-Works-General Civil Work,"41,81,571",4181571.0,Civil Works - Roads,180,Item Rate,Kannnur,30-Jun-2026 04:00 PM,2026-06-30 16:00:00,"Executive Engineer, Roads Division, Kannur","o/o Executive Engineer, Roads Division, Kannur"
Kerala Rural Water Supply and Sanitation Agency||RPMU Idukki,Kerala Rural Water Supply and Sanitation Agency,1,https://etenders.kerala.gov.in/nicgep/app?component=%24DirectLink_0&page=FrontEndAdvancedSearchResult&service=direct&session=T&sp=SSAfb5%2BJfX5IYfaic0jm83Q%3D%3D,2026_KRWSA_857288_1,Works,1,"21,500","1,700",295,Rectification Works of 1 nos Small Water Supply Schemes Under Package-2 of Kattappana Municipality in Idukki District,Rectification Works of 1 nos Small Water Supply Schemes Under Package-2 of Kattappana Municipality in Idukki District,"8,46,125",846125.0,Civil Works - Water Works,90,Item Rate,kattapana muncipality,14-Jul-2026 05:00 PM,2026-07-14 17:00:00,"Regional project Director,Regional project managem","REGIONAL PROJECT DIRECTOR,REGIONAL PROJECT MANAGEMENT UNIT,KRWSA, MATHA ARCADE, THODUPUZHA, IDUKKI - 685584"
University of Calicut,University of Calicut,1,https://etenders.kerala.gov.in/nicgep/app?component=%24DirectLink_0&page=FrontEndAdvancedSearchResult&service=direct&session=T&sp=SMLdiMEwxwLx62O4msPPazA%3D%3D,2026_UoC_857272_1,Works,1,"3,529",655,295,Department of Sanskrit Modernization Eco proof ceiling on class room No 220 and 221-UNDER PM USHA-SCHEME (Re Tender),Department of Sanskrit Modernization Eco proof ceiling on class room No 220 and 221-UNDER PM USHA-SCHEME (Re Tender),"1,41,169",141169.0,Civil Works - Others,30,Percentage,University of Calicut,30-Jun-2026 06:00 PM,2026-06-30 18:00:00,Executive Engineer (Civil),"Office of the Executive Engineer (Civil), Engineering Department, University of Calicut, Calicut University P O, Malappuram District, Kerala 673635."
Local Self Government Department||Ernakulam||Corporation Engineers Office Ernakulam||Corporation Engineer Kochi Corporation,Local Self Government Department,1,https://etenders.kerala.gov.in/nicgep/app?component=%24DirectLink_0&page=FrontEndAdvancedSearchResult&service=direct&session=T&sp=SN6OUoU3KrBFr%2B37JBbjgaw%3D%3D,2026_LSGD_857021_8,Works,1,"2,308",555,295,"MOE2A-KSMART-1791939/2024, KRISHNASWAMY ROAD END (RAILWAY LINE )FOORPATHRETAINING WALL MAINTENANCE General Civil Work- TENDER","MOE2A-KSMART-1791939/2024, KRISHNASWAMY ROAD END (RAILWAY LINE )FOORPATHRETAINING WALL MAINTENANCE General Civil Work- TENDER","92,332",92332.0,Civil Works - Others,180,Item Rate,ERNAKULAM,29-Jun-2026 03:00 PM,2026-06-29 15:00:00,JAYAPRAKASH M.J,"THE OFFICE OF THE ASSISTANT EXECUTIVE ENGINEER, CENTRAL ZONE, KOCHI MUNICIPAL CORPORATION"
Local Self Government Department||Kozhikode||District Panchayath Division Office Kozhikkode||Office of Exec Engg Kozhikkode District panchayath,Local Self Government Department,1,https://etenders.kerala.gov.in/nicgep/app?component=%24DirectLink_0&page=FrontEndAdvancedSearchResult&service=direct&session=T&sp=SARJoj%2BZMvjMjuBK3upvbnw%3D%3D,2026_LSGD_857276_1,Works,1,"42,365","2,760",767,DP KKD 2025-26 Proj. 1162/26 Agricultural Skill Center kodanchery pt,Building,"16,94,616",1694616.0,Civil Works - Buildings,300,Item Rate,Kodenchery,30-Jun-2026 05:00 PM,2026-06-30 17:00:00,Asst.Executive Engineer,LID and EW Division Kozhikkode
Kerala State Electricity Board||Chief Engineer (Civil Construction South)||Deputy Chief Engineer Civil Circle Pallom||EE B and S Division Angamaly||MF1 Subdivision Angamaly,Kerala State Electricity Board,1,https://etenders.kerala.gov.in/nicgep/app?component=%24DirectLink_0&page=FrontEndAdvancedSearchResult&service=direct&session=T&sp=S%2BXtnyG1mlQ2mX%2Bm75SCr5Q%3D%3D,2026_KSEB_855941_1,Works,1,"50,000","5,900",767,"Purchase plan 2026-27- Fabrication of 8 m A poles 150 Nos,10 m A poles 150 Nos,12 m A poles 1100 Nos and 13 m A poles 150 Nos at MF-1, Angamaly.","Purchase plan 2026-27- Fabrication of 8 m A poles 150 Nos,10 m A poles 150 Nos,12 m A poles 1100 Nos and 13 m A poles 150 Nos at MF-1, Angamaly.","20,31,158",2031158.0,Civil Works - Others,90,Percentage,Angamaly south,10-Jul-2026 04:00 PM,2026-07-10 16:00:00,Assistant Executive Engineer,"O/o the Assistant Executive Engineer, MF1 Sub Division, KSEB Ltd,Angamaly"
Forest Department||Divisional Forest Office Chaiakkudy,Forest Department,1,https://etenders.kerala.gov.in/nicgep/app?component=%24DirectLink_0&page=FrontEndAdvancedSearchResult&service=direct&session=T&sp=S2Y6yHqPK%2BW9ydxJ%2BWoZPZg%3D%3D,2026_FD_854187_2,Works,2,"19,933","2,077",295,Construction of EPT protection (Balance portion) Mukkanamkuthu Campshed in Palappilly range during 2026-27,"Construction of EPT protection (Balance portion) Mukkanamkuthu Campshed includes excavation, Dry rubble masonry and concrete belt","7,97,318",797318.0,Civil Works - Others,120,Item Rate,Palappilly,30-Jun-2026 04:00 PM,2026-06-30 16:00:00,Divisional Forest Officer Chalakudy,Divisional Forest Office Chalakudy
PWD||Chief Engineer (Buildings)||Electronics Division Thrissur||Electronics Sub Division Kannur,PWD,1,https://etenders.kerala.gov.in/nicgep/app?component=%24DirectLink_0&page=FrontEndAdvancedSearchResult&service=direct&session=T&sp=SMwaV0RYPC409J8lC1DLo7A%3D%3D,2026_PWD_857306_1,Works,2,"3,794",555,295,DEPOSIT-Payyannur block SC development office- Supply and installation of sound system at Samskarika nilayam (4 Nos)-Portable speaker system-General Electronics Work,DEPOSIT-Payyannur block SC development office- Supply and installation of sound system at Samskarika nilayam (4 Nos)-Portable speaker system-General Electronics Work,"1,51,763",151763.0,Miscellaneous Works,60,Item Wise,Payyannur,30-Jun-2026 06:00 PM,2026-06-30 18:00:00,Assistant Executive Engineer,Assistant Executive Engineer Electronics Sub Division Kannur
PWD||Chief Engineer (Buildings)||SE Bldgs (S)||EE Bldgs (ALP)||AEE BldgsSD Alappuzha,PWD,1,https://etenders.kerala.gov.in/nicgep/app?component=%24DirectLink_0&page=FrontEndAdvancedSearchResult&service=direct&session=T&sp=SSAp73bG08F1ba6VsIRrh6w%3D%3D,2026_PWD_855402_2,Works,1,"8,693",770,295,DEPOSIT-Sub Jail Alappuzha - Providing Fencing-General Civil Work,DEPOSIT-Sub Jail Alappuzha - Providing Fencing-General Civil Work,"3,47,703",347703.0,Civil Works - Buildings,90,Item Rate,Alappuzha,01-Jul-2026 05:00 PM,2026-07-01 17:00:00,Assistant Executive Engineer,Assistant Executive Engineer PWD Buildings Subdivision Alappuzha
