organisation_chain_raw,organisation_name,tender_active,tender_url,tender_id,tender_category,no_of_covers,emd_amount,tender_fee,processing_fee,title,work_description,tender_value,tender_value_num,product_category,period_of_work_days,form_of_contract,location,bid_submission_end_date,bid_end_iso,tender_inviting_authority,authority_address
PWD||Chief Engineer (Bridges)||PWD Bridges North Circle Kozhikode,PWD,1,https://etenders.kerala.gov.in/nicgep/app?component=%24DirectLink_0&page=FrontEndAdvancedSearchResult&service=direct&session=T&sp=SUsLLuq1rNS9s47DsED%2F6nQ%3D%3D,2026_PWD_853895_2,Works,1,"1,00,000","8,270","1,534",GENERAL Re Construction of Puthuppalam Bridge at km 7/040 of Pattambi Amayur Road- Pattambi LAC Palakkad District General Civil Work 1,GENERAL Re Construction of Puthuppalam Bridge at km 7/040 of Pattambi Amayur Road- Pattambi LAC Palakkad District General Civil Work 1,"3,47,36,241",34736241.0,Civil Works - Bridges,540,Item Rate,pattambi,02-Jul-2026 11:00 AM,2026-07-02 11:00:00,"Superintending Engineer, PWD Bridges,North Circle","Superintending Engineer, PWD Bridges,North Circle"
"Travancore Devaswom Board||Executive Engineer,Kottayam",Travancore Devaswom Board,1,https://etenders.kerala.gov.in/nicgep/app?component=%24DirectLink_0&page=FrontEndAdvancedSearchResult&service=direct&session=T&sp=S5hA%2FolnVZTrX5y5Z3xA7Nw%3D%3D,2026_TDB_857224_1,Works,1,"12,800","1,239",295,"Aluva Mahadevar devaswom-Paravur group--Concreting the pathway infront of foot over bridge to prevent the water stagnation, clay and silt during the time of Karkkidakavavu and sivarathry.","Aluva Mahadevar devaswom-Paravur group--Concreting the pathway infront of foot over bridge to prevent the water stagnation, clay and silt during the time of Karkkidakavavu and sivarathry.","5,11,520",511520.0,Civil Works - Others,30,Percentage,Aluva,26-Jun-2026 01:00 PM,2026-06-26 13:00:00,"The Executive Engineer TDB,Kottayam","Office of the Executive Engineer, TDB, Kottayam- 686001"
PWD||Chief Engineer (Roads and Bridges)||SE Roads (C)||EE Roads (IDK),PWD,1,https://etenders.kerala.gov.in/nicgep/app?component=%24DirectLink_0&page=FrontEndAdvancedSearchResult&service=direct&session=T&sp=SIexpKjpT9rpEri368kfOOg%3D%3D,2026_PWD_846705_2,Works,1,"50,000","2,760",767,GENERAL-Budget 24-25-KANCHIYAR PANCHAYATH-PALAKADA PUDHIYAPALAM ROAD CH.0/000 TO 1/200,GENERAL-Budget 24-25-KANCHIYAR PANCHAYATH-PALAKADA PUDHIYAPALAM ROAD CH.0/000 TO 1/200,"21,18,328",2118328.0,Civil Works - Roads,120,Item Rate,Kanchiyar,02-Jul-2026 11:00 AM,2026-07-02 11:00:00,Executive Engineer,PWD Roads division Idukki
Kerala State Electronics Development Corp Ltd||Keltron Equipment Complex,Kerala State Electronics Development Corp Ltd,1,https://etenders.kerala.gov.in/nicgep/app?component=%24DirectLink_0&page=FrontEndAdvancedSearchResult&service=direct&session=T&sp=S3kDPF6zAoCgltM3eBj1B1Q%3D%3D,2026_KSEDC_857195_1,Goods,2,"14,400","2,550",295,SUPPLY OF DOOR FRAME METAL DETECTOR,SUPPLY OF DOOR FRAME METAL DETECTOR,,,Equipments,,Item Rate,KEC KARAKULAM,30-Jun-2026 06:00 PM,2026-06-30 18:00:00,HEAD PURCHASE,"Sanjay N, Manager Head (Purchase) Keltron Equipment Complex Karakulam Trivandrum"
PWD||Chief Engineer (Roads and Bridges)||SE Roads (N)||EE Roads (KNR),PWD,1,https://etenders.kerala.gov.in/nicgep/app?component=%24DirectLink_0&page=FrontEndAdvancedSearchResult&service=direct&session=T&sp=SUMfG4Dn0%2BvBfH%2Fge4laz8A%3D%3D,2026_PWD_857217_1,Works,1,"50,000","2,760",767,GENERAL Budget 2019 20 (20) Kottam Puzhakkara Road Side Protection Work General Civil Wor,GENERAL-Budget 2019-20 (20) Kottam Puzhakkara Road Side Protection-Work General Civil Wor,"20,62,964",2062964.0,Civil Works - Roads,270,Item Rate,Kannnur,30-Jun-2026 04:00 PM,2026-06-30 16:00:00,"Executive Engineer, Roads Division, Kannur","Executive Engineer, Roads Division, Kannur"
PWD||Chief Engineer (Roads and Bridges)||SE Roads (N)||EE Roads (KNR),PWD,1,https://etenders.kerala.gov.in/nicgep/app?component=%24DirectLink_0&page=FrontEndAdvancedSearchResult&service=direct&session=T&sp=SAwYXhJmlKEauK0gT1%2B2eIQ%3D%3D,2026_PWD_857197_1,Works,1,"50,000","2,760","1,534",GENERAL Budget 2019 20 (20) Panonnery Town Beautification and Infrastructure Development-.-General Civil Work,GENERAL-Budget 2019-20 (20) Panonnery Town Beautification and Infrastructure Development-.-General Civil Work,"50,67,634",5067634.0,Civil Works - Roads,180,Item Rate,Kannnur,30-Jun-2026 04:00 PM,2026-06-30 16:00:00,"Executive Engineer, Roads Division, Kannur","o/o Executive Engineer, Roads Division, Kannur"
Local Self Government Department||Kozhikode||Grama Pnchayath Section Offices Kozhikkode||Office of the AE Chekkyad Grama Panchayath,Local Self Government Department,1,https://etenders.kerala.gov.in/nicgep/app?component=%24DirectLink_0&page=FrontEndAdvancedSearchResult&service=direct&session=T&sp=SF6vADai9IQIiQXhfsIfNvA%3D%3D,2026_LSGD_844372_7,Works,1,"9,522",840,295,Annual Plan-CHEKKIAD GP 2024-2025 P 51-BASIC FACILITIES TO ANGANWADIS General Civil Work,Annual Plan-CHEKKIAD GP 2024-2025 P 51-BASIC FACILITIES TO ANGANWADIS General Civil Work,"3,80,879",380879.0,Civil Works - Roads,180,Item Rate,CHEKKIAD GRAMA PANCHAYATH,30-Jun-2026 01:00 PM,2026-06-30 13:00:00,SHEELA P R,ASSISTANT ENGINEER LID EW SECTION CHEKKIAD GP
Steel and Industrial Forgings Ltd||Works||Materials Management,Steel and Industrial Forgings Ltd,1,https://etenders.kerala.gov.in/nicgep/app?component=%24DirectLink_0&page=FrontEndAdvancedSearchResult&service=direct&session=T&sp=S7N1rn5tAwDxZ0%2FmbemkOHg%3D%3D,2026_SIFL_857186_1,Goods,2,0.00,0.00,767,"Supply of forging quality steel SAE 4130 Size 125 RCS, Qty 25.00 MT","Supply of forging quality steel SAE 4130 Size 125 RCS, Qty 25.00 MT",,,Raw Materials,15,Item Wise,M/s Steel and Industrial Forgings Ltd,30-Jun-2026 02:00 PM,2026-06-30 14:00:00,GM (WORKS),M/s Steel and Industrial Forgings Ltd. Athani P.O. Thrissur 680 581
PWD||Chief Engineer (Buildings)||SE Bldgs (N)||EE Bldgs (WYD)||AEE BldgsSD Sulthanbathery,PWD,1,https://etenders.kerala.gov.in/nicgep/app?component=%24DirectLink_0&page=FrontEndAdvancedSearchResult&service=direct&session=T&sp=S5ENVVj0CABIrqFPKYCJXug%3D%3D,2026_PWD_857212_1,Works,1,"6,682",590,295,"GENERAL-Pre-monsoon Work- 2026-2027 for Clearing Jungles, Cutting trees, Drainage Cleaning etc.. for various asset under -PWD Buildings Section, Sultan Bathery-General Civil Work","GENERAL-Pre-monsoon Work- 2026-2027 for Clearing Jungles, Cutting trees, Drainage Cleaning etc.. for various asset under -PWD Buildings Section, Sultan Bathery-General Civil Work","2,67,278",267278.0,Civil Works - Buildings,90,Item Rate,Suthanbathery,30-Jun-2026 05:00 PM,2026-06-30 17:00:00,Assistant Executive Engineer,PWD Buildings SubDivision Sulthan bathery
"Kerala Water Authority||Chief Engineer Central Region (Kochi)||Superintending Engineer PH Circle Kochi||Executive Engineer (Water Supply Division Kochi)||AEE, WS Sub Division, Tripunithura",Kerala Water Authority,1,https://etenders.kerala.gov.in/nicgep/app?component=%24DirectLink_0&page=FrontEndAdvancedSearchResult&service=direct&session=T&sp=SMC2KL1gK%2Fu1rEM1%2BFrc6xg%3D%3D,2026_KWA_857214_1,Works,1,"28,514","2,760",767,O and M Water Supply Schemes TRIPUNITHURA MUNICIPALITY AMC WSS to Tripunithura Municipality and Adjoining Pts Northern side of NH 49 NH 85 for the year 2026 27 Pipeline Work,O and M Water Supply Schemes TRIPUNITHURA MUNICIPALITY AMC WSS to Tripunithura Municipality and Adjoining Pts Northern side of NH 49 NH 85 for the year 2026 27 Pipeline Work,"11,40,567",1140567.0,Civil Works - Water Works,365,Item Rate,"Northside, Tripunithura",30-Jun-2026 03:00 PM,2026-06-30 15:00:00,Assistant Executive Engineer,"Water Works Subdivision, Tripunithura, PIN-682306"
"Kerala Water Authority||Chief Engineer Central Region (Kochi)||Superintending Engineer PH Circle Kochi||Executive Engineer (Water Supply Division Kochi)||AEE, WS Sub Division, Tripunithura",Kerala Water Authority,1,https://etenders.kerala.gov.in/nicgep/app?component=%24DirectLink_0&page=FrontEndAdvancedSearchResult&service=direct&session=T&sp=S4mB0gUeLQ2co4g2xt9LlOQ%3D%3D,2026_KWA_857120_1,Works,1,"30,430","2,760",767,O and M Water Supply Schemes TRIPUNITHURA MUNICIPALITY AMC WSS to Tripunithura Municipality and Adjoining Pts Southern side of NH 49 NH 85 for the year 2026 27 Pipeline Work,O and M Water Supply Schemes TRIPUNITHURA MUNICIPALITY AMC WSS to Tripunithura Municipality and Adjoining Pts Southern side of NH 49 NH 85 for the year 2026 27 Pipeline Work,"12,17,202",1217202.0,Civil Works - Water Works,365,Item Rate,Sothside Tripunithura,30-Jun-2026 03:00 PM,2026-06-30 15:00:00,Assistant Executive Engineer,"Water Works Subdivision, Tripunithura, PIN-682306"
PWD||Chief Engineer (Buildings)||SE Bldgs (S)||EE Bldgs (TVM)||AEE BldgsSD Trivandrum,PWD,1,https://etenders.kerala.gov.in/nicgep/app?component=%24DirectLink_0&page=FrontEndAdvancedSearchResult&service=direct&session=T&sp=SaUMq%2FObYZJFrzu%2FB9Ehr4w%3D%3D,2026_PWD_857202_1,Works,1,"8,470",750,295,"GENERAL-PWD Quarters- Laying and relaying of roof tiles and other connected works in E9A and E9B-Providing new roof tile, relaying existing roof tile and laying new roofing sheet in the building for preventing leakage issues in E9A and E9B Quarters l","GENERAL-PWD Quarters- Laying and relaying of roof tiles and other connected works in E9A and E9B-Providing new roof tile, relaying existing roof tile and laying new roofing sheet in the building for preventing leakage issues in E9A and E9B Quarters l","3,38,817",338817.0,Civil Works - Buildings,90,Item Rate,Thiruvananthapuram,04-Jul-2026 11:00 AM,2026-07-04 11:00:00,Assistant Executive Engineer,"O/o the Assistant Executive Engineer, PWD Buildings Sub division, PMG, Thiruvananthapuram."
"Irrigation Department||CE(I and A)||SE,MIC,TVPM||EE,MI Div.,Kottayam",Irrigation Department,1,https://etenders.kerala.gov.in/nicgep/app?component=%24DirectLink_0&page=FrontEndAdvancedSearchResult&service=direct&session=T&sp=SABj2KOBHyqa2kE5XkpJz2A%3D%3D,2026_Irrig_839039_4,Works,1,"11,439","1,010",295,GENERAL-Paluvelil thodu -Protecting the left bank of Paluvelil thodu u/s of Paluvelil culvert in ward no.3 of Karukachal panchayath in Kanjirappally LAC-General Civil Work,DR retaining wall for a total length of 24.6 m with height of 3 m is proposed at left bank of Paluvelil thodu u/s of Paluvelil culvert in ward no.3 of Karukachal panchayath,"4,57,555",457555.0,Civil Works - Others,270,Item Rate,Karukachal,01-Jul-2026 05:00 PM,2026-07-01 17:00:00,Assistant Executive Engineer,"o/o of the Assistant Executive Engineer, MI Sub Division Kottayam"
PWD||Chief Engineer (Roads and Bridges)||SE Roads (S)||EE Roads (TVM),PWD,1,https://etenders.kerala.gov.in/nicgep/app?component=%24DirectLink_0&page=FrontEndAdvancedSearchResult&service=direct&session=T&sp=SotO98%2F0d%2BcyCUkpd7h87%2Fg%3D%3D,2026_PWD_857187_1,Works,1,"50,000","2,760",767,GENERAL Raising of carriageway and allied Works for mitigate flooding at Elamthengu in Kulathara Kalady south road From Ch 0 650 to Ch-0 800-GeneralCivilWork,GENERAL Raising of carriageway and allied Works for mitigate flooding at Elamthengu in Kulathara Kalady south road From Ch 0 650 to Ch-0 800-GeneralCivilWork,"21,17,874",2117874.0,Civil Works - Roads,90,Item Rate,Thiruvananthapuram,02-Jul-2026 02:00 PM,2026-07-02 14:00:00,The Executive Engineer,Roads Division P M G Thiruvananthapuram
"Irrigation Department||CE(I and A)||SE,MIC,TVPM||EE,MI Div.,Kottayam",Irrigation Department,1,https://etenders.kerala.gov.in/nicgep/app?component=%24DirectLink_0&page=FrontEndAdvancedSearchResult&service=direct&session=T&sp=SVEUvm%2B%2BJUeTPr2TsEJXrnA%3D%3D,2026_Irrig_839127_5,Works,1,"11,399","1,005",295,GENERAL-Nathalloor maakkeel Thommacheri thodu -Protecting the right bank of Nathalloor maakkeel Thommacheri thodu Kochedathinattu bhagom in ward no4 of Karukachal panchayath-General Civil Work,DR retaining wall is proposed at Nathalloor Maakkeel Thommacheri thodu at ward No 4 of Karukachal panchayath.,"4,55,965",455965.0,Civil Works - Others,270,Item Rate,Karukachal,01-Jul-2026 05:00 PM,2026-07-01 17:00:00,AEE,"AEE, MI Sub Division Kottayam"
PWD||Chief Engineer (Buildings)||SE (Electrical)||EE Elect (KKD),PWD,1,https://etenders.kerala.gov.in/nicgep/app?component=%24DirectLink_0&page=FrontEndAdvancedSearchResult&service=direct&session=T&sp=SCInqvRsjGMMA7NkEDkmD%2BA%3D%3D,2026_PWD_857107_2,Works,1,"50,000","2,760",767,"GENERAL Balance Work (PHASE-2) Finishing Works of New Building for Mukkam Police Station,Thiruvambady Constituency, Kozhikode Electrification General Electrical Work","GENERAL Balance Work (PHASE 2) Finishing Works of New Building for Mukkam Police Station Thiruvambady Constituency, Kozhikode-Electrification General Electrical Work","21,77,597",2177597.0,Electrical Works,,Item Rate,MUKKAM,30-Jun-2026 06:00 PM,2026-06-30 18:00:00,Executive Engineer,PWD ELECTRICAL DIVISION KOZHIKODE
Keltron Component Complex Ltd||Materials Department,Keltron Component Complex Ltd,1,https://etenders.kerala.gov.in/nicgep/app?component=%24DirectLink_0&page=FrontEndAdvancedSearchResult&service=direct&session=T&sp=S12%2B7tIVUcFh1cI0Y5IJ%2BwQ%3D%3D,2026_KCCL_854535_2,Goods,2,"17,740",590,767,SUPPLY OF ALUMINIUM CASING,SUPPLY OF 430K VARIOUS TYPES OF ALUMINIUM CASING,"17,74,000",1774000.0,Raw Materials,90,Item Wise,KELTRON NAGAR,30-Jun-2026 04:00 PM,2026-06-30 16:00:00,MANAGING DIRECTOR,KELTRON COMPONENT COMPLEX LTD KELTRON NAGAR PO KALLIASSERI KANNUR 670 562 KERALA INDIA
Kerala State Coastal Area Development Corporation,Kerala State Coastal Area Development Corporation,1,https://etenders.kerala.gov.in/nicgep/app?component=%24DirectLink_0&page=FrontEndAdvancedSearchResult&service=direct&session=T&sp=SRrxqMTZZ3x53R1Gxk3bCNw%3D%3D,2026_SCADC_857207_1,Works,1,"38,500","2,950",767,FISHERIES Establishment of Nile Tilapia Hatchery at Malampuzha in Palakkad District Supply and Installation of Hatchery Accessories,FISHERIES Establishment of Nile Tilapia Hatchery at Malampuzha in Palakkad District Supply and Installation of Hatchery Accessories,"15,24,444",1524444.0,Miscellaneous Works,90,Item Rate,Malampuzha in Palakkad District.,30-Jun-2026 05:00 PM,2026-06-30 17:00:00,"CHIEF ENGINEER, KSCADC","KSCADC Building, Kamalewsaram , Manacaud P.O. Thiruvananthapuram Pin-695009"
"Irrigation Department||CE(I and A)||SE,MIC,KZKD||EE,MI Div.,MLPM",Irrigation Department,1,https://etenders.kerala.gov.in/nicgep/app?component=%24DirectLink_0&page=FrontEndAdvancedSearchResult&service=direct&session=T&sp=Sv30VNuQOzJ%2F%2F9Lr4yTTNLw%3D%3D,2026_Irrig_857163_1,Works,1,"50,000","2,760",767,"GENERAL-REPAIR WORK FOR PUMP HOUSE ROAD IN KOORIYAD-Repair work for Pump house road in Kooriyad , Vengara panchayath, Vengara LAC, Malappuram District.-General Civil Work","GENERAL-REPAIR WORK FOR PUMP HOUSE ROAD IN KOORIYAD-Repair work for Pump house road in Kooriyad , Vengara panchayath, Vengara LAC, Malappuram District.-General Civil Work","48,47,399",4847399.0,Civil Works - Others,,Item Rate,Vengara Panchayath,06-Jul-2026 06:00 PM,2026-07-06 18:00:00,Shylimon P P,Executive Engineer Minor Irrigation Division B1 Block Civil Station Malappuram 676505
Kerala State Coastal Area Development Corporation,Kerala State Coastal Area Development Corporation,1,https://etenders.kerala.gov.in/nicgep/app?component=%24DirectLink_0&page=FrontEndAdvancedSearchResult&service=direct&session=T&sp=Suy1CJsLZ%2F7i4Harl4VkM0g%3D%3D,2026_SCADC_857189_1,Works,1,"50,000","2,950",767,FISHERIES Establishment of Nile Tilapia Hatchery at Malampuzha in Palakkad District General Civil Work,FISHERIES Establishment of Nile Tilapia Hatchery at Malampuzha in Palakkad District General Civil Work,"34,28,649",3428649.0,Civil Works - Buildings,180,Item Rate,Malampuzha in Palakkad District.,30-Jun-2026 05:00 PM,2026-06-30 17:00:00,"CHIEF ENGINEER, KSCADC","KSCADC Building, Kamalewsaram , Manacaud P.O. Thiruvananthapuram Pin-695009"
Local Self Government Department||Idukki||Grama Panchayath Section Office IDK||Office of the AE Rajakkad Grama Panchayath,Local Self Government Department,1,https://etenders.kerala.gov.in/nicgep/app?component=%24DirectLink_0&page=FrontEndAdvancedSearchResult&service=direct&session=T&sp=SEJ3pjjPTLadn3TRCDehrhA%3D%3D,2026_LSGD_852371_3,Works,1,"8,472",750,295,Mulackal Kanakakunnu DWS Pond maintenance in Rajakkadu grama panchayat,Mulackal Kanakakunnu DWS Pond maintenance in Rajakkadu grama panchayat,"3,38,862",338862.0,Civil Works - Others,90,Item Rate,Rajakkad GP,30-Jun-2026 03:00 PM,2026-06-30 15:00:00,Preethu Pushpan,"The Assistant Engineer, LSGD Section, Rajakkad Grama Panchayat"
Local Self Government Department||Thiruvananthapuram||Corporation Engineers Office TVM||Thiruvananthapuram Corporation,Local Self Government Department,1,https://etenders.kerala.gov.in/nicgep/app?component=%24DirectLink_0&page=FrontEndAdvancedSearchResult&service=direct&session=T&sp=ShsRF9BELRlc6iWPWKl8y9w%3D%3D,2026_LSGD_857125_4,Works,1,"22,896","2,020",295,77668-2025 GENERAL-MOTTAVILA-KURUMKULAM CHENCHERY ROAD IN MANNANTHALA WARD-CHENCHERY ROAD IN MANNANTHALA WARD.-General Civil Work,77668-2025 GENERAL-MOTTAVILA-KURUMKULAM CHENCHERY ROAD IN MANNANTHALA WARD-CHENCHERY ROAD IN MANNANTHALA WARD.-General Civil Work,"9,15,843",915843.0,Civil Works - Roads,180,Item Wise,Thiruvananthapuram Corporation,30-Jun-2026 06:00 PM,2026-06-30 18:00:00,Superintending Engineer,"O/O Superintending Engineer, LID and EW Thiruvananthapuram Corporation"
Local Self Government Department||Thiruvananthapuram||Corporation Engineers Office TVM||Thiruvananthapuram Corporation,Local Self Government Department,1,https://etenders.kerala.gov.in/nicgep/app?component=%24DirectLink_0&page=FrontEndAdvancedSearchResult&service=direct&session=T&sp=SJ7eoXWnLtj9Dv9IpAo2Ghw%3D%3D,2026_LSGD_857125_3,Works,1,"21,179","1,870",295,"56851-2025 GENERAL-MAINTENANCE OF DRAIN AT EMS NAGAR HOUSING BOARD KANNANMOOLA WARD, THIRUVANNATHAPURAM MAINTENANCE OF DRAIN -General Civil Work",56851-2025 GENERAL-MAINTENANCE OF DRAIN AT EMS NAGAR HOUSING BOARD KANNANMOOLA WARD THIRUVANNATHAPURAM MAINTENANCE OF DRAIN -General Civil Work,"8,47,157",847157.0,Civil Works - Roads,180,Item Wise,Thiruvananthapuram Corporation,30-Jun-2026 06:00 PM,2026-06-30 18:00:00,Superintending Engineer,"O/O Superintending Engineer, LID and EW Thiruvananthapuram Corporation"
Local Self Government Department||Idukki||Grama Panchayath Section Office IDK||Office of the AE Rajakkad Grama Panchayath,Local Self Government Department,1,https://etenders.kerala.gov.in/nicgep/app?component=%24DirectLink_0&page=FrontEndAdvancedSearchResult&service=direct&session=T&sp=S7vbd0stm4eqWg5S6iMi9yw%3D%3D,2023_LSGD_634472_2,Works,1,"10,209",905,295,Construction of toilet block for Pazhayaviduthi UPSchool in Rajakkad GPConstruction of toilet block for Pazhayaviduthi UPSchool in Rajakkad GP,Construction of toilet block for Pazhayaviduthi UPSchool in Rajakkad GPConstruction of toilet block for Pazhayaviduthi UPSchool in Rajakkad GP,"4,08,358",408358.0,Civil Works - Others,90,Item Rate,Rajakkad GP,30-Jun-2026 03:00 PM,2026-06-30 15:00:00,Preethu Pushpan,"The Assistant Engineer, LSGD Section, Rajakkad Grama Panchayat"
Local Self Government Department||Pathanamthitta||Block Panchayath Sub Division Office PTHTA||O/O Asst. Exec Engg Ranny Block Panchayath,Local Self Government Department,1,https://etenders.kerala.gov.in/nicgep/app?component=%24DirectLink_0&page=FrontEndAdvancedSearchResult&service=direct&session=T&sp=SFay2%2BjYlvDoLlwDuhKrOfg%3D%3D,2026_LSGD_857043_1,Works,1,"10,288",910,295,SC Corpus Fund-Harijan nagar road concreting Vadasserikara GP (Retender),SC Corpus Fund-Harijan nagar road concreting Vadasserikara GP (Retender),"4,11,509",411509.0,Civil Works - Roads,150,Item Rate,Rannibp,03-Jul-2026 06:00 PM,2026-07-03 18:00:00,Rana MR,"Office of the Assistant Executive Engineer, LIDEW Sub Division, Ranni Block Panchayat"
Local Self Government Department||Thiruvananthapuram||Corporation Engineers Office TVM||Thiruvananthapuram Corporation,Local Self Government Department,1,https://etenders.kerala.gov.in/nicgep/app?component=%24DirectLink_0&page=FrontEndAdvancedSearchResult&service=direct&session=T&sp=S5waqVPDvOJ7JN%2BSq3N4OpQ%3D%3D,2026_LSGD_854636_22,Works,1,"34,370","2,760",767,29024-2024 General-MLA work Goureeshapattom temple pond maintenance in Pattom ward General Civil Work Retender,29024-2024 General-MLA work Goureeshapattom temple pond maintenance in Pattom ward General Civil Work Retender,"13,74,790",1374790.0,Civil Works - Roads,180,Item Rate,Thiruvananthapuram Corporation,30-Jun-2026 06:00 PM,2026-06-30 18:00:00,Superintending Engineer,"O/O Superintending Engineer, LID and EW Thiruvananthapuram Corporation"
Local Self Government Department||Pathanamthitta||Block Panchayath Sub Division Office PTHTA||O/O Asst. Exec Engg Ranny Block Panchayath,Local Self Government Department,1,https://etenders.kerala.gov.in/nicgep/app?component=%24DirectLink_0&page=FrontEndAdvancedSearchResult&service=direct&session=T&sp=S%2F%2B4EifCqaXsL%2FkZp2ErYKg%3D%3D,2026_LSGD_857043_2,Works,1,"19,066","1,685",295,Kulam Construction and Renovation in Various Division of Ranni Block Panchayath-Ranni BP Annual plan 2025-26-90/25(Retender),Kulam Construction and Renovation in Various Division of Ranni Block Panchayath-Ranni BP Annual plan 2025-26-90/25(Retender),"7,62,624",762624.0,Civil Works - Water Works,210,Item Rate,Rannibp,03-Jul-2026 06:00 PM,2026-07-03 18:00:00,Rana MR,"Office of the Assistant Executive Engineer, LIDEW Sub Division, Ranni Block Panchayat"
Rural Development Department||Commissionerate for Rural Development||Asst Development Commissioner (General) Kasargod||Manjeswaram Block Panchayath,Rural Development Department,1,https://etenders.kerala.gov.in/nicgep/app?component=%24DirectLink_0&page=FrontEndAdvancedSearchResult&service=direct&session=T&sp=S11Ag24ujDoORDE73KpruWQ%3D%3D,2026_CRD_846084_3,Works,1,"10,583",935,295,MLA-SDF- 2025-26-AACHARAYITHULU CLAAYI COMPOUND ROAD IN PAIVALIKE GRAMA PANCHAYATH -GENERAL CIVIL WORK,MLA-SDF- 2025-26-AACHARAYITHULU CLAAYI COMPOUND ROAD IN PAIVALIKE GRAMA PANCHAYATH -GENERAL CIVIL WORK,"4,23,318",423318.0,Civil Works - Roads,180,Item Rate,PAIVALIKE GRAMA PANCHAYATH,30-Jun-2026 06:00 PM,2026-06-30 18:00:00,BLOCK DEVELOPMENT OFFICER,"Block Development Officer, Manjeshwaram Block Development Office , Kasaragod"
Local Self Government Department||Thiruvananthapuram||Corporation Engineers Office TVM||Thiruvananthapuram Corporation,Local Self Government Department,1,https://etenders.kerala.gov.in/nicgep/app?component=%24DirectLink_0&page=FrontEndAdvancedSearchResult&service=direct&session=T&sp=S2XdqT5xi31FDI9Yxu21VoA%3D%3D,2026_LSGD_854636_18,Works,1,769,335,295,122590-2024 Annual Plan-Maintenance Work UHWC-URBEN Health Wellness Centre Valiyasala ward General Civil Work Retender,122590-2024 Annual Plan-Maintenance Work UHWC-URBEN Health Wellness Centre Valiyasala ward General Civil Work Retender,"30,756",30756.0,Civil Works - Buildings,90,Item Rate,Thiruvananthapuram Corporation,30-Jun-2026 06:00 PM,2026-06-30 18:00:00,Superintending Engineer,"O/O Superintending Engineer, LID and EW Thiruvananthapuram Corporation"
Local Self Government Department||Thiruvananthapuram||Corporation Engineers Office TVM||Thiruvananthapuram Corporation,Local Self Government Department,1,https://etenders.kerala.gov.in/nicgep/app?component=%24DirectLink_0&page=FrontEndAdvancedSearchResult&service=direct&session=T&sp=SevBI%2FQTDJc38khMh5OIXQg%3D%3D,2026_LSGD_857125_1,Works,1,"38,018","2,760",767,117642-2025 TVM-Corporation-Maintenance of Charummoodu-Kuzhikkottukonam Devi temple road -in Njandoorkonam ward-Gen Civil Work,117642-2025 TVM-Corporation-Maintenance of Charummoodu-Kuzhikkottukonam Devi temple road -in Njandoorkonam ward-Gen Civil Work,"15,20,715",1520715.0,Civil Works - Roads,180,Item Wise,Thiruvananthapuram Corporation,30-Jun-2026 06:00 PM,2026-06-30 18:00:00,Superintending Engineer,"O/O Superintending Engineer, LID and EW Thiruvananthapuram Corporation"
Local Self Government Department||Thiruvananthapuram||Corporation Engineers Office TVM||Thiruvananthapuram Corporation,Local Self Government Department,1,https://etenders.kerala.gov.in/nicgep/app?component=%24DirectLink_0&page=FrontEndAdvancedSearchResult&service=direct&session=T&sp=SPsCe91mDPUBJW7c0XJ24Dg%3D%3D,2026_LSGD_847417_3,Works,1,"7,200",635,295,"4081-2026 LAC-ADS-Balance Work Construction of Take A Break toilet in Kurissadi Convent Road and Construction of Rain water pit in Anupama Nagar in Kinavoor Ward, Kudappanakunnu zonal-MLA -ADS 2025-26-General Civil Work Retender","4081-2026 LAC-ADS-Balance Work Construction of Take A Break toilet in Kurissadi Convent Road and Construction of Rain water pit in Anupama Nagar in Kinavoor Ward, Kudappanakunnu zonal-MLA -ADS 2025-26-General Civil Work Retender","2,88,015",288015.0,Civil Works - Buildings,180,Item Rate,Thiruvananthapuram Corporation,30-Jun-2026 06:00 PM,2026-06-30 18:00:00,Superintending Engineer,"O/O Superintending Engineer, LID and EW Thiruvananthapuram Corporation"
Local Self Government Department||Thiruvananthapuram||Corporation Engineers Office TVM||Thiruvananthapuram Corporation,Local Self Government Department,1,https://etenders.kerala.gov.in/nicgep/app?component=%24DirectLink_0&page=FrontEndAdvancedSearchResult&service=direct&session=T&sp=S2fw64Fgk9TsBXR3NP8MLrw%3D%3D,2026_LSGD_854636_20,Works,1,"8,037",710,295,26550-2026 GeneralL-Own fund Urgent Road maintenance-Road maintenance in St.Antonys lane in Kunnukuzhy ward-General Civil Work Retender,26550-2026 GeneralL-Own fund Urgent Road maintenance-Road maintenance in St.Antonys lane in Kunnukuzhy ward-General Civil Work Retender,"3,21,485",321485.0,Civil Works - Roads,120,Item Rate,Thiruvananthapuram Corporation,30-Jun-2026 06:00 PM,2026-06-30 18:00:00,Superintending Engineer,"O/O Superintending Engineer, LID and EW Thiruvananthapuram Corporation"
